<?xml version="1.0" encoding="utf-8"?>

<VTJ4ES_orarend 
 xmlns:xsi="http://www.w3.org/2001/XMLSchema-instance"
    xsi:noNamespaceSchemaLocation="VTJ4ES_orarend.xsd">

    <ora id="1" tipus="elmelet">
        <targy> Számítógép hálózatok </targy>
        <idopont>
            <nap> Hétfő </nap>
            <tol> 08:00 </tol>
            <ig>  09:30 </ig>
        </idopont>
        <helyszin> 032 </helyszin>
        <oktato> dr. Kovács Szilveszter </oktato>
        <szak> Programtervező Informatikus </szak>
    </ora>

    <ora id="2" tipus="elmelet">
        <targy> Mesterséges Intellegencia Alapjai </targy>
        <idopont>
            <nap> Kedd </nap>
            <tol> 10:00 </tol>
            <ig>  11:30 </ig>
        </idopont>
        <helyszin> 033 </helyszin>
        <oktato> Fazekas Levente </oktato>
        <szak> Programtervező Informatikus </szak>
    </ora>

    <ora id="3" tipus="gyakorlat">
        <targy> Mesterséges Intellegencia Alapjai </targy>
        <idopont>
            <nap> Kedd </nap>
            <tol> 12:00 </tol>
            <ig>  13:30 </ig>
        </idopont>
        <helyszin> 033 </helyszin>
        <oktato> Fazekas Levente </oktato>
        <szak> Programtervező Informatikus </szak>
    </ora>
    
    <ora id="4" tipus="elmélet">
        <targy> Adatkezelés XML-ben </targy>
        <idopont>
            <nap> Szerda </nap>
            <tol> 08:00 </tol>
            <ig>  09:30 </ig>
        </idopont>
        <helyszin> A/1 310 </helyszin>
        <oktato> dr. Kovács János </oktato>
        <szak> Programtervező Informatikus </szak>
    </ora>

    <ora id="5" tipus="gyakorlat">
        <targy> Adatkezelés XML-ben </targy>
        <idopont>
            <nap> Szerda </nap>
            <tol> 10:00 </tol>
            <ig>  11:30 </ig>
        </idopont>
        <helyszin> L103 </helyszin>
        <oktato> dr. Bednarik László </oktato>
        <szak> Programtervező Informatikus </szak>
    </ora>

    <ora id="6" tipus="elmelet">
        <targy> Vállalati Információs Rendszerek Fejlesztése </targy>
        <idopont>
            <nap> Szerda </nap>
            <tol> 14:00 </tol>
            <ig>  15:30 </ig>
        </idopont>
        <helyszin> L103 </helyszin>
        <oktato> dr. Sasvári Péter </oktato>
        <szak> Programtervező Informatikus </szak>
    </ora>

    <ora id="7" tipus="gyakorlat">
        <targy> Vállalati Információs Rendszerek Fejlesztése </targy>
        <idopont>
            <nap> Szerda </nap>
            <tol> 18:00 </tol>
            <ig>  19:30 </ig>
        </idopont>
        <helyszin> L103 </helyszin>
        <oktato> dr. Sasvári Péter </oktato>
        <szak> Programtervező Informatikus </szak>
    </ora>

    <ora id="8" tipus="gyakorlat">
        <targy> Számítógépes hálózatok </targy>
        <idopont>
            <nap> Csütörtök </nap>
            <tol> 10:00 </tol>
            <ig>  11:30 </ig>
        </idopont>
        <helyszin> 33 </helyszin>
        <oktato> dr. Kovács Szilveszter </oktato>
        <szak> Programtervező Informatikus </szak>
    </ora>

</VTJ4ES_orarend>